,label,class0 id,class0 name,class1 id,class1 name,keyword,sentence
223,0,0,계절인사,0,여름,수해,장마가 끝났다고 해도 오늘처럼 비가 계속 오는 걸 보니 또다시 수해가 나지 않을까 걱정이 되는 하루하루입니다.좀 처럼 그치지 않고 내리는 비가 야속하기도 하네요.
224,0,0,계절인사,0,여름,보양식,한여름밤의 꿈처럼 깨어났을 때 허무하고 먼 여행을 다녀온 느낌처럼 더위에 지쳐 잠이 드는 요즘은 몸이 찌뿌둥하고 기력이 없네요.보양식이라도 먹어야 할 것 같은 더운 여름날 입니다.
225,0,0,계절인사,0,여름,동료의 얼굴,여름 휴가를 다녀온 동료들의 얼굴이 건강하게 타서 보는 사람으로하여금 바닷가 풍경을 떠올리게 하는 8월 말 입니다.
226,0,0,계절인사,0,여름,얼음 가득한 팥빙수,시원한 바람이 부는 그늘에서 얼음 가득한 팥빙수를 먹고 있는 사람들의잠시 더위를 식히고 있는 공원의 풍경이 평화로워 보이는 7월 마지막 주입니다.
227,0,0,계절인사,0,여름,도시의 풍경,한차례 소나기가 지나간 도시의 풍경은 깨끗하게 씻긴 빌딩과 물기 먹은 가로수그리고 잠시 땀을 식힌 사람들의 상쾌한 표정이 잠시 더위를 잊은 듯 보입니다.
228,0,0,계절인사,0,여름,시골 할머니댁,시골 할머니댁 원두막 그늘에서 시원한 수박과 미숫가루를 먹으며 만화책을 보던어린 시절 여름방학이 생각나 웃음을 지어보는 8월 한 여름입니다.
229,0,0,계절인사,0,여름,지친 나무와 열매,가을의 아름다운 결실을 위해서는 이렇게 뜨거운 여름 햇살을 견뎌야 하는가 봅니다.더위에 지친 나무들에 매달린 열매들은 더 많은 태양빛과 영양분을 원하겠지요.더위가 한창인 8월 첫 주입니다.
230,0,0,계절인사,0,여름,등목,찬 물로 시원하게 등목을 하고 잘 익은 수박을 먹고 싶은 더운 오후입니다.여름이 더울수록 가을에 풍성하다고 하는데 이 더위만큼  ○○○님 하시는 일은 잘 되고 있는지요.
231,0,0,계절인사,0,여름,아침,한 낮에는 아직 뜨겁게 태양이 내리쬐지만 조금씩 아침저녁에 부는 바람은 선선해진 듯 합니다.○○○님
232,0,0,계절인사,0,여름,빨래,안녕하세요? ○○○님○○○사의 ○○○입니다.올 장마는 다른 해보다 무척 길어서 빨래가 마를 날이 없네요.축축한 날이 계속되고 있는데 건강 유의하시기 바랍니다.
233,0,0,계절인사,0,여름,무더위,뜨거운 열대야로 인해 잠을 설치는 여름날이 계속되고 있습니다.○○○님도 요즘 힘든 여름밤 보내고 계시지요?
234,0,0,계절인사,0,여름,나무,○○○님무더운 날씨가 이어지고 있네요.거리의 나무들도 더위에 지쳐 축축 늘어져 있는 듯 합니다.
235,0,0,계절인사,0,여름,매미,매미 울음소리가 찢어지듯 귀를 시끄럽게 울리는 한여름입니다.한철 사는 곤충이지만 열심히 우는 걸 보면 우리네 삶도 그만큼 치열하게 살아야한다는 생각이 드네요.
236,0,0,계절인사,0,여름,자동차,안녕하세요? ○○○님이번주는 여름휴가가 한창이라 시내에 차들이 별로 많지 않아 한산하네요.○○○님은 여름휴가 다녀오셨는지요.
237,0,0,계절인사,0,여름,에어콘,뜨겁게 내리쬐는 태양에 점점 지쳐가는 오후입니다.에어콘의 찬바람에 냉방병이 유행이라고 하는데 ○○○님은 요즘 어떻게 여름을 나고 계신지요.
238,0,0,계절인사,0,여름,땀,안녕하세요?등줄기에 땀이 쉴새없이 내리는 요즘은 빨리 가을이 오기를 바랄 뿐입니다.○○○님은 이 더위에 요즘 어떻게 지내시는지요.
239,0,0,계절인사,0,여름,거리,뜨겁게 내리쬐는 햇살 때문에 거리엔 사람들이 별로 다니질 않네요.아직 7월인데 8월 한달간 남은 여름을 지내야하는 일이 무척 힘겹게 느껴집니다.그러나 더위를 식히는 한낮의 소나기가 있어 세상은 공평하게 느껴집니다.
240,0,0,계절인사,0,여름,회사휴가,안녕하세요? ○○○입니다.저희 회사는 다음주에 전체 여름 휴가입니다.○○○님은 언제 여름 휴가가 있으신가요?즐거운 휴식이 있어 뜨거운 여름을 버틸 수 있는 것 같습니다.
241,0,0,계절인사,0,여름,휴가,○○○님 안녕하세요?○○○○사의 ○○○입니다.여름 휴가는 다녀오셨는지요. 저는 다음주로 예정되어 있어서 금주에 처리할 일이 많네요.휴가를 기다리는 마음에 더 열심히 일을 하게 됩니다.
242,0,0,계절인사,0,여름,청량음료,한낮의 소나기는 뜨거운 도시에 새로 활력을 주는 청량음료 같네요.좀전에 퍼붓듯 내리던 비가 그치니 거리가 반짝반짝 활기차졌습니다.안녕하세요? ○○○ 입니다.
243,0,0,계절인사,0,여름,잠,겨울은 추워야 맛이고 여름은 더워야 맛이겠지요?그래도 너무 더워서 밤엔 잠을 설치기가 일쑤입니다.○○○님은 요즘 어떻게 지내시는지요.
244,0,0,계절인사,0,여름,기온,안녕하세요?오늘 한 낮의 기온이 30도가 넘어서 거리의 아스팔트가 녹을 지경이라고 합니다.○○○님 건강은 어떠신지요?
245,0,0,계절인사,0,여름,여름휴가,신나는 여름 휴가도 모두 끝나고 이제 아침저녁으로 무척 서늘해졌습니다.지난 여름날의 그 열기와 뜨거움이 온데간데 없이 사라졌네요.
246,0,0,계절인사,0,여름,더위,덥다 덥다 타박하는 동안 더욱 더위가 기승을 부리고 있습니다.여름은 어느 계절보다 더 외근 업무를 힘들게 하네요.안녕하세요? ○○○사의 ○○○입니다.
247,0,0,계절인사,0,여름,외근,거리에 내리쬐는 여름 햇볕 때문에 외근나가기가 두려운 날입니다.이 더위가 빨리 가시기를 바랄 뿐이네요.
248,0,0,계절인사,0,여름,장마비,지금 밖에는 장마비가 심하게 내리네요.저 장마가 그치면 무더위가 심할 거라고 합니다.○○○님은 요즘 장마철 건강하게 보내시는지요.
249,0,0,계절인사,0,여름,열대야,더운 여름밤이 이어지고 있습니다.지난밤은 열대야로 인해서 잠을 설쳤더니 오늘 몸이 무척 무겁네요.○○○님은 안녕히 어떠신가요?
