,label,class0 id,class0 name,class1 id,class1 name,keyword,sentence
229,0,3,요일인사,6,금요일,봄날씨,"주말을 앞둔 오늘, ○○○님은 좋은 약속 있으신가요?화창한 날이 이어지고 있는 요즘 같은 봄날씨에내일 주말이 기다려지네요."
230,0,3,요일인사,5,목요일,힘든 출근길,월요일도 아닌데 출근 버스가 의외로 많이 밀리는 목요일입니다.아이들이 개학을 해서인지 힘든 출근길이었네요.
231,0,3,요일인사,5,목요일,막바지 무더위,시원한 바람이 불어와 더위를 식혀주는 8월 마지막주 목요일 비오는 오후입니다.막바지 무더위가 기승을 부리더니 아침부터 내리는 비에 한 풀 꺽였네요.
232,0,3,요일인사,5,목요일,주말 만남 약속,금요일도 남았고 주말은 멀었는데 주말 만남 약속 전화가 많이 오네요.요즘 봄볕이 좋아서 사람들이 야외로 많이 나가길 원하는 것 같습니다.안녕하세요? ○○○ 입니다.
233,0,3,요일인사,5,목요일,비오는 목요일,가을비가 하루종일 주룩주룩 내리는 목요일 오후입니다.단풍놀이 가기로 한 주말에는 날이 화창하게 개여야 할텐데요.주말이 기다려지는 비오는 목요일입니다.
234,0,3,요일인사,5,목요일,더운 목요일,주중에 가장 길게 느껴지는 목요일 아침입니다.오늘만 지나면 내일 금요일부터 주말 기분이 날텐데 날이 더워서그런지 좀 힘든 하루네요.
235,0,3,요일인사,5,목요일,은행잎,우수수 떨어지는 은행잎과 바람에 이리저리 몰려다니는 낙엽들이 부서져 가을 지나가는소리가 울리는 늦가을 목요일입니다.
236,0,3,요일인사,5,목요일,선인장,다른 날 보다 길게 느껴지지만 책상 위 선인장에 오랜만에 물을 주며 마음의여유를 갖고 목요일 오후를 지내고 있습니다.○○○님도 오늘이 길게 느껴지시나요?
237,0,3,요일인사,5,목요일,술 한 잔,"○○○님, 안녕하셨습니까?내일은 금요일이니 오늘 저녁 간단히 술 한 잔 하면서 친구들과 이야기를나누고 싶은 목요일 오후입니다."
238,0,3,요일인사,5,목요일,드라이브,마음은 벌써 주말 드라이브를 떠나고 있는 듯 조금씩 설레어지는목요일 오후를 보내고 있습니다.안녕하세요? ○○○ 입니다.
239,0,3,요일인사,5,목요일,커피 한 잔,"○○○님,한 주 동안 하루가 가장 길게 느껴진다고 하는 목요일이 시작되었습니다.긴 하루를 보내기 전에 향긋한 커피 한 잔 마시면서오늘 하루를 챙겨보는 건 어떨까요?"
240,0,3,요일인사,5,목요일,겨울 옷,찬바람이 거세져 오늘 아침엔 겨울 옷 중에서 조금 얇은 옷을 찾아봤습니다.안녕하세요? 겨울 초입의 목요일 아침입니다.
241,0,3,요일인사,5,목요일,편지,"○○○님,어제까지는 정신없이 바쁘고 찾아가야 할 곳이 많았는데한 주가 마무리되는 목요일인 오늘은 친구들도 생각나고문득 편지를 쓰고 싶은 마음이 드네요."
242,0,3,요일인사,5,목요일,테라스,안녕하십니까?차 한 잔의 여유를 부리며 테라스 긴 벤치에 앉아 거리를 내다보는 시간을 갖고 있습니다.주중에 가장 피곤함을 느끼는 목요일엔 이렇게 잠시 여유를 갖는휴식도 필요한 듯 합니다.
243,0,3,요일인사,5,목요일,바다,"○○○님, 안녕하세요?마음은 벌써 바다로 향하는 듯 설레이고 남은 한 주가 다른 때보다더 길게 느껴지는 목요일 아침입니다."
244,0,3,요일인사,5,목요일,전화,"○○○님,오늘은 주말에 만날 사람들을 생각하며 어디론가 전화를 계속 하고싶어지는 목요일이네요."
245,0,3,요일인사,5,목요일,뜨거운 태양,뜨거운 태양이 아침부터 등허리를 땀으로 적시게 하는목요일 아침입니다.
246,0,3,요일인사,5,목요일,축제,안녕하세요?5월이 되니 여기저기 축제도 많고 전시회도 많이 생기는 것 같습니다.주말이 기다려지는 목요일입니다.
247,0,3,요일인사,5,목요일,주말 기분,"○○○님, 안녕하세요?오늘만 지나면 내일은 주말 기분을 낼 수 있는 금요일입니다.오늘 하루도 거리의 맑은 햇살처럼 긍정적으로 지내면 주말이 더욱즐거울 수 있을 것입니다."
248,0,3,요일인사,5,목요일,장미꽃,골목길마다 돌담을 타고 피어난 장미가 출근길을 상쾌하게 만드는목요일 아침입니다.
249,0,3,요일인사,5,목요일,봄비,"○○○님, 그동안 안녕하셨습니까?아침까지 내리던 봄비가 그치고 파랗게 푸른 잎들이 돋아나는 소리가 들리는 듯 맑은목요일 오후입니다."
