,label,class0 id,class0 name,class1 id,class1 name,keyword,sentence
162,0,7,주제별인사,12,이직인사,제자리에 안주하는 삶,"회사를 옮긴다고 했을 때 많은 분들이 만류를 했었습니다. 왜 쉬운 길을 어렵게 가느냐, 지금까지 쌓아온 탑을 왜 무너뜨리느냐 걱정들을 많이 했지요.하지만 쉬운 일만 하면서 더 큰 탑을 과연 쌓을 수 있을까 고민이 많았습니다.제자리에 안주하는 삶에 술을 마시는 날이 많았습니다. 하지만 이제 그 술잔을 접고 고난의 길을 가려 합니다.함께 했던 여러분들과의 추억도 잠시 잊고 뜨거운 가슴으로 달려가고자 합니다.열심히 하겠습니다."
163,0,7,주제별인사,12,이직인사,정들었던 책상을 떠난다는 아쉬움,"회사를 옮긴다는 것은 이사를 가는 것처럼 쉬운 일은 아닌 것 같습니다. 두려움, 고민, 후회, 그리고 무엇보다도 정들었던 책상을 떠난다는 아쉬움이 끝까지 발목을 잡네요.내일 아침에 일어나면 4호선 대신 1호선을 타야한다는 것이 믿기질 않지만 다시 초심으로 돌아가서 시작하는 마음으로 벽돌을 하나씩 쌓아올리며 거성을 이루겠습니다.그 동안 저의 고민을 들어주셨던 과장님, 그리고 술 잔을 돌리며 함께 한 동기분들의 앞날에 빛나는 미래가 있기를 바라겠습니다."
164,0,7,주제별인사,12,이직인사,투자의 기회,언제부턴가 이직이라 함은 회사를 배신하는 것이 아니라 자신을 좀 더 높은 곳으로 올려놓는 투자라 생각하게 되었습니다.회사는 그런 투자의 기회를 제공할 수 있어야 더 큰 회사로 거듭날 수 있다고 생각하고요.제가 이직을 할 수 있는 건 그런 회사의 배려가 있었기에 가능한 일이라고 봅니다.성공하는 결과로 보답하겠습니다.
165,0,7,주제별인사,12,이직인사,성공하는 모습,술 한 잔 하려고 했는데 결국 이렇게 짧게 인사를 드리게 되네요.갑작스럽게 결정된 일이고 일주일간 고민을 하면서 시간이 어떻게 갔는지 모르겠습니다.하지만 저의 결정이 여러분들에게 칭찬을 받고 언제고 시간을 내서 식사라도 하면서 지난 날을 정리할 시간을 주셨으면 합니다.꼭 성공하는 모습 보여드리겠습니다.
166,0,7,주제별인사,12,이직인사,후회 없는 20대,사람들은 회사를 옮길 때 조용하게 처리하는데 저는 널리 알리고 부산을 좀 떨었습니다.그건 더 좋은 조건으로 이직을 한다는 뜻이 아니라 더 힘든 일을 하면서 저의 젊음을 뜨겁게 불태우고 후회 없는 20대를 보내기 위해서입니다.그래서 자랑스럽게 말씀을 드렸던거고 이제 그 길을 한발자국 내딛으려 합니다.응원해주신 동료분들에게 감사드리며 발전하는 저의 모습을 지켜봐주시기 바랍니다.
167,0,7,주제별인사,12,이직인사,빚을 진 기분,"이렇게 인사를 드리게 되어 죄송한 마음도 들고 또 감사의 마음도 듭니다.그동안 못난 저를 잘 돌봐주시고 이해해 주신 부장님과 동료분들께 빚을 진 기분입니다.다른 회사를 가서도 여러분들이 가르쳐준 따뜻한 인간애와 아량, 그리고 우리 ○○ 회사의 모토인 사회 봉사와 헌실에 주력해서 더 멋지게 살겠습니다.감사합니다!"
168,0,7,주제별인사,12,이직인사,샐러리맨들이 겪는 일,직장을 구하고 퇴사를 하고 다시 새로운 회사로 가는 일은 우리 샐러리맨들이 겪는 일들 중에 하나의 과정이라고 봅니다.그 과정을 얼마나 슬기롭게 견디고 올바른 선택을 하느냐가 참 중요하지요.저는 오늘 그 중요한 결정을 하게 되어 두려운 마음도 듭니다. 처음도 아닌데 다른 회사로 간다는 것은 늘 긴장을 하게 되네요.그래도 여러분들이 잘 도와주셔서 가능한 일입니다.감사의 마음을 전합니다.
169,0,7,주제별인사,12,이직인사,인연이란 끈,삶은 연속적이면서도 인연이란 끈에 의하여 재조정되는 측면이 있는 것 같습니다.처음 우리 회사에 들어왔을 땐 영원할 거라고 생각했는데 점점 무기력해지고 작아지는 저의 모습을 보며 다시 돌이켜 생각해볼 시간이 많아졌습니다.이제 그 생각을 행동으로 옮기며 동료 여러분들게 인사드리게 되어 송구스럽습니다.부디 행복하고 보람찬 하루하루 보내시길 바라며 저도 더욱 열심히 노력하는 삶 만들겠습니다.그 동안 감사했습니다.
170,0,7,주제별인사,12,이직인사,즐거운 기억 행복한 추억,안녕하세요?오늘부로 이직을 하게 된 ○○○입니다.다른 회사로 간다고 해서 영영 떠나는 게 아니라 계열사로 가기 때문에 자주 인사드릴 듯 합니다.요청해서 가는 거긴 하지만 그래도 약 3년간 몸담았던 곳이라서 정이 많이 남아 있습니다.즐거운 기억 행복한 추억 모두 담고 더 열심히 일하는 모습 보여드리겠습니다.여러분도 언제나 즐겁게 일하시고 건강하세요~
171,0,7,주제별인사,12,이직인사,따뜻한 격려,"여러분, 사랑하는 사람과 헤어져 본 적 있으시죠? 그 쓰리고 아픈 마음을 기억하시나요?오늘 저는 그런 쓰린 느낌입니다. 제가 선택한 길이지만 그래도 잘 해야한다는 두려움도 있고 안락한 보금자리를 벗어나는 섭섭함도 있습니다.단지 돈을 위해서 떠나는 것이 아니라 삶의 행복한 보람과 가치를 위해서 떠나는 것임을 이해해주십시오.여러분들의 따뜻한 격려 잊지 않겠습니다."
172,0,7,주제별인사,12,이직인사,더 큰 미래와 발전,"사람은 하고 싶은 일을 하지 않으면 병이 나는 수도 있나봅니다.제가 원했던 일을 하지 못해서 마음을 아파했던 시간을 여러분도 잘 아시지요.더 큰 미래와 발전을 위해서 떠나가게 됨을 이해해주시고 응원해주시면 감사하겠습니다.많이 주저하고 망설였지만, 이 정든 회사를 떠나는 것이 두려웠지만 살아가면서 한번쯤 도전해보고 싶었기에 이렇게 인사를 드립니다.멋진 모습으로 보답하겠습니다."
173,0,7,주제별인사,12,이직인사,살아가면서 하기 싫은 일,"정든 곳을 떠난다는 것은 살아가면서 힘든 일 중에 하나가 아닐까 합니다.헤어지고 만나는 일이 반복되면서 무뎌질만도 한데, 매번 섭섭한 마음과 허전한 마음으로 떠나는 느낌을 갖는다는 건 하기 싫은 일이지요.오늘 그 하기 싫은 일을 하게 되어 또 마음이 무겁습니다.하지만 하기 싫은 일을 해야 하고 싶은 일을 할 수 있겠지요.그 동안 감사했습니다."
174,0,7,주제별인사,12,이직인사,새로운 꿈,첫 출근하고 인사를 한 게 엊그제 같은데 이렇게 이직을 하게 되어 아쉬운 인사를 드리게 되니 정든 곳을 떠나는 섭섭함이 크게 느껴집니다.첫 날의 그 포부와 자부심으로 다시 새로운 곳에서 새로운 꿈을 꾸려는 저를 이해해주시고 함께 했던 시간을 즐거운 추억으로 남겨주시길 부탁드립니다.늘 건강하시고 행복하십시오.
175,0,7,주제별인사,13,웹진,사랑의 느낌,"밤이 깊어도 잠이 오지 않는 건 누군가를 그리워하는 겁니다.혼자 밥을 먹기 싫은 건 누군가가 이미 마음 속에 있는 겁니다. 혼자 운전을 하고 있는 차 안이 넓게 느껴진다면 누군가를 사랑하는 겁니다.혼자 하기 싫은 일, 아무것도 아니지만 누군가와 함께 하면 즐거울 일, 그것이 바로 사랑이 아닐까 합니다.그런 사랑의 느낌으로 오늘의 이야기 만나보세요."
176,0,7,주제별인사,13,웹진,마음을 다스리는 법,세차를 하고 나면 비가 오고 흰옷을 입고 나온 날에는 꼭 김치국물이 튀는 머피의 법칙처럼 삶은 어떤 규칙들이 무분별하게 이어진 것처럼 보일 때가 있습니다.실제 그건 규칙이 아니라 그렇게 느끼는 것 뿐인데 말이죠.자기 최면과도 같은 쓸데없는 법칙을 만들기보다는 마음을 다스리는 법을 개발하는 건 어떨까요?삶은 그렇게 단순하지 않을 겁니다.
177,0,7,주제별인사,13,웹진,찹쌀떡을 파는 겨울,"아직도 추운 겨울 밤을 헤치며 찹쌀떡을 사라고 외치는 사람이 있다는 것이 신기한 겨울입니다.어릴 적 먹을 것이 귀했을 때, 찹싸～알떠억 하고 외치던 고마운 사람이 있어 행복했던 기억으로 눈 오는 밤에 나가 일부러 찹쌀떡을 사 본 겨울을 나고 있습니다.회원님들도 행복한 겨울 나고 계시지요?"
178,0,7,주제별인사,13,웹진,친구의 갑작스런 연락,"갑작스런 친구의 연락으로 잠시 옛추억에 잠긴 적 있으신가요?그냥 술 한 잔 하고 싶다는 친구에게 이유를 묻지 않고 묵묵히 술잔을 채워주며 서로 말하지 않아도 편안한 자리, 그런 친구가 그리운 가을입니다."
179,0,7,주제별인사,13,웹진,사랑의 세월,"따뜻한 봄햇살을 즐기며 공원 벤치에 앉아 도란도란 이야기를 나누는 노부부의 모습을 보고 있으면 나도 늙어서 저러고 싶다... 생각이 절로 들지요?늙어서도 변치 않는 부부의 사랑은 젊은이들의 열정적인 사랑과는 다른 어떤 힘이 있습니다.그 힘은 세월속에서 더욱 단단히 굳어져 온 것이기에 이 봄, 포근한 봄바람이 더 살갑게 느껴지는 거겠지요.그런 사랑의 세월 속으로 함께 떠나 가보지 않으시겠어요?"
180,0,7,주제별인사,13,웹진,자유롭게 날아다니는 비둘기,"더 이상 사람을 두려워하지 않는 비둘기들은 닭처럼 나중엔 날아다니는 걸 잊어버릴지 않을까 생각합니다.진화란 삶의 편리성에서 도발되는 순서이지만 바닥에 떨어진 음식물에 취해서 생존에 필요한 것을 도태시킨다면 그것은 진화가 아니라 실패가 아닐까요?다만 가볍고 자유롭게 날아다니는 비둘기를 보고 싶은 봄날, 나른한 주말입니다."
181,0,7,주제별인사,13,웹진,장마철 비를 맞는 객기,"아무리 큰 장우산을 써도 들이닥치는 비에 옷이 금방 젖어버리는 장마철, 다들 한번쯤 겪어 보셨지요?결국 머리만 젖지 않았을 뿐, 다 젖은 몸으로 보내야하는 장마철이라면 그냥 우산 없이 실컷 비를 맞아도 보고 싶다는 생각이 듭니다.속옷까지 다 젖게 비를 맞는 객기, 그런 날에는 따뜻한 물로 샤워를 시원하게 할 수 있을 거에요.장마가 시작된 7월 첫 주 어떻게 보내고 계신가요?"
182,0,7,주제별인사,13,웹진,음악속의 꿈과 열정,쉽게 다운로드 받아 듣는 음악 속에도 꿈과 열정이 있습니다. 다운로드를 받는 그 순간만이라도 음악을 만드느라 밤을 새웠을 뮤지션을 위해 잠시 눈을 감아보는 건 너무 감상적일까요?8G의 MP3플레이어에 꽉 찬 음악들을 보며 잠시 이런 생각을 해봤습니다. 8G를 다운로드 받는 시간 만큼 그 분들의 노고를 한번 생각해 보겠노라고...어려분의 MP3플레이어는 몇 G인가요? 뮤지션들의 노고만큼 넉넉하십니까?
183,0,7,주제별인사,13,웹진,개성 있는 캐릭터,"항상 새로운 모습, 새로운 계획을 보여드려야 한다고 생각했는데 그것은 일종의 집착이 아닌가 생각이 들었습니다.같은 모습이라도 성실하고 뚝심있게 나가는 것도 캐릭터가 아닐까 싶어서요.우리 웹진의 캐릭터는 회원님께 어떤 모습인가요?개성있는 캐릭터는 아닐지라도 쉽게 잊혀지지 않는 모습 보여드리고 싶습니다."
184,0,7,주제별인사,13,웹진,영화 웹진 인사,다시 돌아오겠다는 약속을 한 로봇은 10년 후에라도 그 약속을 지켜 다시 왔고 늙어버린 근육의 영웅들도 화려하게 부활했습니다.세월이 지나서 늙고 주름지고 배가 나온 모습이 서글픔을 주긴 하지만 그래도 변치 않은 용기와 원숙한 눈빛은 한 시대를 함께 살아온 동시대 사람으로서 반가운 마음을 간직하게 하지요.그런 반가움으로 시작하는 이 달의 웹진 만나보십시오.
185,0,7,주제별인사,13,웹진,여행의 계절,"‘여행’이란 말은 그 자체만으로도 설레이고 가보지 못했던 곳에 대한 동경을 일어나지 않으세요?산으로 바다로 떠나는 여행의 계절, 설레임의 계절, 여러분들과 함께 시작하고자 합니다.시작은 언제라도 가능합니다. 다만 지금이냐 다음이냐 그것이 문제지요. 바로 ‘지금’ 시작해보세요."
186,0,7,주제별인사,13,웹진,순수한 마음으로 돌아가고 싶은 마음,아기의 눈을 가만히 들여다보면 아무것도 숨길 것도 없고 어떤 욕심도 없어서 마음이 편안해지는 걸 느낄 겁니다.그건 바로 우리 인간이 최초에 가졌던 순수함 그 자체이기 때문이겠지요.다시 순수한 마음으로 돌아가고 싶다면 거울 속 자신의 눈 속을 들여보세요.무엇도 숨길 필요 없는 시간을 만날 수 있을 겁니다.
187,0,7,주제별인사,13,웹진,밤새워 쓴 연애편지,"밤새워 쓴 연애편지를 아침에 다시 읽어보지 말라는 말이 있습니다.밤에 젖어들었던 감성에서 적어 내려갔던 고백들이 맑은 태양 아래에서는 이성적이 되어서 부끄럽고 숨기고픈 마음이 들기 때문이지요.지금 누군가를 사랑한다면 힘겹게 쓴 연애편지는 바로 풀을 붙여 버리는 용기, 그게 필요할 때입니다."
188,0,7,주제별인사,13,웹진,향긋한 복숭아와 포다가 여름을 가득 채우는 8월,"작은 뱃속에 빨간 피를 채우려고 어둔 밤을 웽웽거리며 날아다니는 모기의 외로운 사투, 그 모기를 없애기 위한 모기향, 홈매트, 에프킬러... 이런 한 여름의 풍경이 8월에도 이어지고 있나요?향긋한 복숭아와 포도가 여름을 가득 채우는 8월의 행복 만나보실 시간입니다."
189,0,7,주제별인사,13,웹진,한 겨울 속 젊은이들의 모습,"하얀 눈처럼 맑은 마음으로 추운 겨울에도 파랗게 피어나는 청춘이란 단어는 뜨거운 여름을 생각나게 합니다.푸른 바다를 그리워하는 한 겨울 속 젊은이들의 모습이 스키장 가득 살아 숨쉬는 이 겨울, 행복한 항해를 시작합니다."
190,0,7,주제별인사,14,연주회,학원 연주회 초대 인사,"학부모 여러분, 그간 안녕하셨습니까?희망의 계절, 사랑의 계절 5월입니다.본원에서는 그동안 열심히 준비한 음악으로 부모님들을 초대하여 우리 아이들이 얼마나 멋지고 훌륭한 음악인인지 보여드리고자 “○○○ 연주 축제”에 초대합니다.본원을 항상 아껴주시는 학부모님께 감사드리는 마음으로 정성껏 준비하였으니 바쁘시더라도 참석해주셔서 우리 아이들의 멋진 연주회를 즐겁게 감상해보시기 바랍니다."
191,0,7,주제별인사,14,연주회,피아노 학원 연주회,안녕하세요?오늘 우리 학원 연주회를 위해 힘든 시간을 보내고 열심히 연습해온 우리 사랑스런 아이들의 얼굴을 보니 감격스러운 마음이 듭니다.아이들은 어른들과는 달리 악기가 내는 소리를 가감없이 그대로 보여주며 기교가 없고 속임이 없습니다.그래서 더 사랑스럽고 기쁜 마음으로 들 수 있을 것입니다.우리 아이들이 오늘 연주회를 열 수 있게 물심양면으로 도와주신 부모님들에게도 감사드리며 앞으로 더 큰 음악인으로 성장할 수 있게 오늘 연주회에 뜨거운 박수 보내주시기 바랍니다.
192,0,7,주제별인사,14,연주회,음악은 영혼에 주는 영양제,사랑하는 구민 여러분!음악은 영혼에 주는 영양제라는 말이 있습니다.음악은 우리 각박한 삶에 따스한 웃음을 주고 잊어버렸던 추억을 돌아보게 합니다.우리 구립 오케스트라 정기연주회를 통해 날로 푸르러져 5월의 하늘과 꽃향기에 취해보시길 바라며 멋진 하모니에도 많은 박수 부탁드리는 바입니다.
193,0,7,주제별인사,14,연주회,입주민들이 준비한 연주회,반갑습니다.바쁘신데 와주신 여러분들 앞에 멋진 연주를 해야할텐데 이렇게 떨리니 잘 될지 걱정이네요.그래도 같은 입주민들이 하루하루 준비한 오늘 연주회는 이웃들의 사랑과 행복을 빌고 우리 아이들의 아름다운 정서 함양을 위해서 몇 달간 준비한 소중한 연주회입니다.부디 실수가 있더라도 너그러이 봐주시고 다같이 즐기는 마음으로 들어주시기 바랍니다.
194,0,7,주제별인사,14,연주회,직장 동호회 연주회,취미가 같다는 이유로 모인 사람들이 이렇게 동료분들을 초대해서 연주회를 하게 되니 무척 감격스럽고 행복합니다.오늘 만큼은 직장동료가 아닌 연주자로서 봐주시고 영화 속 주인공이 되어서 아름다운 하모니에 흠뻑 취해보시기 바랍니다.
195,0,7,주제별인사,14,연주회,천상의 아름다운 하모니,같은 소리라도 어떤 사람에게는 신경이 거슬리는 소음이 되고 어떤 사람에게는 천상의 아름다운 하모니가 되지요.이제 여러분들은 천국으로 가는 아름다운 길을 걷는 기분으로 피아노 선율이 들려주는 선물을 받으실 준비가 되었을 겁니다.하얀 날개를 달았다고 생각하시고 훨훨 날아가보시기 바랍니다.
196,0,7,주제별인사,14,연주회,졸업 연주회,뜨거운 여름을 보내고 선선한 가을을 맞이했을 때 마치 축제가 끝난 듯한 기분이었습니다.이제 졸업 연주회를 시작하며 다시 한번 멋진 축제를 펼쳐보고 싶습니다. 준비되셨나요?겨울을 맞이하는 행복한 시간 보내시기 바랍니다.
197,0,7,주제별인사,14,연주회,음악학원 연주회,떨어지는 은행잎이 춤을 추는 듯 가을 햇살에 반짝이는 10월입니다.부족한 시간을 쪼개서 연습한 지난 시간들이 아깝지 않게 가장 아름다운 소리를 만들 우리 학생들에게 축하와 격려의 박수를 먼저 부탁드립니다.
198,0,7,주제별인사,14,연주회,이야기가 있는 음악 연주회,"따뜻한 차 한 잔과 이야기가 있는 음악 연주회에 참석해주신 귀빈 여러분, 반갑습니다.추억을 찾아가는 길은 멀지만 음악이 들려주는 옛 이야기는 가깝습니다.그 때 그 마음으로 돌아가는 설레임, 한번 느껴보시기 바랍니다."
199,0,7,주제별인사,14,연주회,학생들이 준비한 연주회,"마음으로 듣는 연주회에 오신 여러분들을 환영합니다.오늘 연주회는 피아노, 바이올린 독주로 꾸며졌으며 우리 학생들이 2달간 매일 저녁 땀흘리며 연습한 소중한 연주회입니다.고민이나 복잡한 숙제는 잠시 잊어버리시고 눈을 감고 조용히 감상해보시기 바랍니다.악기가 아닌 살아있는 자연의 소리를 들으실 수 있을 것입니다."
200,0,7,주제별인사,15,안부인사,비바람을 맞던 여행,"많은 사람들이 기억하고, 또 웃음을 짓게 하는 종혁씨,잘 지내고 있어? 거기 날씨는 요즘 어때? 여기는 연일 비바람이야.작년 이맘때 여행을 갔다가 이렇게 비바람을 맞으며 삼일을 갇혀 있던 기억에 문득 메일이라도 보내고 싶어졌어.종혁씨 요즘 연락도 없고 해서 말야."
201,0,7,주제별인사,15,안부인사,퇴원 기념 카페지기 인사,"회원님들 안녕하세요?그 동안 몸이 아파서 우리 카페도 제대로 돌보지 못했는데 오늘 보니 열성 회원님들 위주로 스스로들 이벤트도 하시고, 아주 열정적이신데요?카페지기로서 눈물이 날 지경입니다.그래서 그냥 지나칠 수 없어 인사도 드릴 겸 이렇게 퇴원 기념 메일을 보냅니다."
202,0,7,주제별인사,15,안부인사,동고동락했던 친구,애인에게는 자주 전화를 하면서 애인이 생기기 전에 동고동락했던 친구는 등한시 한 나를 용서해다오 친구야.그동안 어떻게 지냈냐?나는 너도 알다시피 결혼 얘기 나오기 시작하면서 몸이 바빠지기 시작했다.그냥 연애할 때와는 달라졌어.정신없이 지내다 보면 니가 생각나서 오늘은 이렇게 차분하게 앉아서 안부 메일을 쓴다.
203,0,7,주제별인사,15,안부인사,통유리가 있던 카페,"오늘처럼 바람이 많이 불고 구름들이 낮게 떠있는 날, 우리가 함께 자주 갔던 카페가 생각나.통유리 전체로 보이던 그 곳은 거리를 내려다보며 향긋한 커피를 마시곤 했었지.주연씨, 잘 지내고 있어?"
204,0,7,주제별인사,15,안부인사,퇴사한 직원에게 안부 인사,"현주양,오랜만이네. 요즘 잘 지내고 있나?우리 회사에서 공부한다고 퇴사한 사람은 현주양이 처음이라서 그런지 동료들이 기대가 커.그리고 오늘은 합격자 발표 하는 날이고 해서 내가 대표로 인사도 할 겸 메일을 보내기로 했거든."
205,0,7,주제별인사,15,안부인사,커피를 마시며 안부 인사,"선우씨,그토록 원하던 직장에 가서 그런지 행복한가봐? 통 연락도 없고...많이 바쁘지?나도 요즘 연말이라 정신이 없다.그래도 이렇게 바쁘면 항상 선우씨가 도와줘서 그런지 자꾸만 선우씨가 생각나. 잠깐 커피 마시면서 안부 인사 하려고..."
206,0,7,주제별인사,15,안부인사,아버지의 메일,"진우야,요즘 통 연락도 없고 많이 바쁘냐?하기야 니가 회사에서 진급한지 얼마되지 않아서 여기 저기 일도 많고 만날 사람도 많겠지.그래도 건강 잘 챙겨서 아침 꼭 먹고 그래라. 아버지는 이제 컴퓨터를 잘 다루게 되어서 이렇게 너에게 메일도 보내게 되어 좋단다.이거 자랑하려고 메일 보내는 거니 바쁘면 답장 하지 않아도 된단다."
207,0,7,주제별인사,15,안부인사,전우에게 안부,"잘 지냈냐?내 이름만 보고 바로 충성! 하고 경례를 할 것 같은 너의 얼굴이 떠오른다.그래, 이젠 사회인이 되었으니 경례를 할 필요 없고, 했습니까? 라고 말할 필요도 없겠지.전우애라는 것이 이렇게 우리들 사이에서 점점 사라지고 이젠 친구처럼 되어가는 듯 하구나."
208,0,7,주제별인사,15,안부인사,꽃향기가 짙어가는 봄,"선배, 잘 지냈어요?선배가 퇴사한지가 작년 이맘 때 쯤이지요?꽃향기가 짙어가는 봄이라서 그런지 그 때가 참 많이 생각나요.그 섭섭함, 그리고 나도 따라가고 싶은 마음...그래서 문득 선배가 보고 싶어져서 메일을 쓰게 되었답니다."
209,0,7,주제별인사,15,안부인사,교수님께 안부인사,"교수님, 안녕하셨습니까?95학번 김승환입니다.졸업 후에 자주 찾아뵈려고 했는데 세월은 벌써 이렇게 지나버렸고 해마다 스승의 날에만 찾아뵙는 것도 부끄러워 그냥 이렇게 날씨 놓은 오후에 안부 인사를 드립니다."
210,0,7,주제별인사,15,안부인사,바쁜 동생에게,"성민아,누나가 오랜만에 메일을 써보네. 결혼을 한 후에 멀리 떨어진 듯 느껴지지만 그래도 우리 남매가 다른 형제들과는 달리 돈독한 정을 만들어 가는 세월이 얼마나 깊은지 너도 잘 알지?전화를 하려다가 바쁠 거 같아서 이렇게 메일을 쓴다."
211,0,7,주제별인사,15,안부인사,사람이 그리운 날,"선배님,혼자 골방처럼 생긴 고시원에서 있다보니 사람이 그리워져 이렇게 메일을 씁니다.공부에 뜻을 두고 혼자만의 싸움을 하는 것도 참 힘들고 외로운 일이군요."
212,0,7,주제별인사,15,안부인사,고향 생각,"어머니, 그동안 안녕하셨습니까?먼 이국 땅에 있다고 하지만 자주 전화도 못 드리고 잠깐씩 생각나는 고향 생각에 어머니 얼굴을 떠올리고만 있습니다.메일도 자주 못드리고 죄송합니다."
213,0,7,주제별인사,15,안부인사,시인의 눈빛을 가진 친구,작은 바람에도 마음 아파했다던 시인의 눈빛을 가진 친구여!잘 지냈는가?오늘 떨어지는 꽃잎들을 보다가 자네와 술 한잔 하고 싶은 생각이 간절하여 이렇게 메일이라도 쓰면서 그리운 마음을 달래려 한다네.
214,0,7,주제별인사,15,안부인사,선생님이 주신 편지,"선생님, 안녕하세요?저 미란이에요.오늘 사진첩을 정리하다가 문득 선생님이 주신 편지를 보고 왈콱 눈물이 쏟아졌어요.그리고 한참동안 옛 사진을 보다가 이렇게 메일이라도 쓰려고 인사를 드립니다."
