,label,class0 id,class0 name,class1 id,class1 name,keyword,sentence
109,0,7,주제별인사,8,수료식,농업기술원 수료식,"땅에서 자라고 먹고 마시는 모든 것은 우리 생명과 같습니다.예부터 젖과 꿀이 흐르는 땅에서는 인재가 나고 복이 넘치며 웃음이 끝나지 않는다고 하였습니다.우리 땅의 소중함을 알고 그 고단한 여정을 걸어갈 준비를 마치신 우리 미래 영농 후계자 여러분들의 땀과 노력을 격려하고, 또 힘든 과정을 마치신 것에 축하드립니다."
110,0,7,주제별인사,8,수료식,마케터 수료식,"한 기업의 생명은 마케팅에 있다고 해도 관언이 아닙니다.좋은 제품을 알리는 일, 그것은 제품을 만드는 일보다 더 중요하고 가치있는 일이라 할 수 있습니다.이제 우리 ○○원의 마케터 수료식을 마치고 일선에 나아가 마케터로서 소임을 다할 당당한 일꾼으로서의 여러분들을 기대하며 언제든 다시 만나도 저와 웃으며 고객과 마케터,혹은 기업과 고객의 입장에서 악수할 수 있기를 기원합니다."
111,0,7,주제별인사,8,수료식,보육원 교사 수료식,어린이들의 때묻지 않은 맑은 얼굴과 투명한 눈을 보며 미소를 지을 수 있는 여러분들은 바로 천사입니다.천사란 따로 있지 않습니다.날개를 달지 않아도 하얀 날개보다 더 큰 사랑의 날개를 가지고 있으며 하늘을 날지 않아도 애정과 보살핌은 이미 하늘빛으로 가득 차 있습니다.아름다운 봉사심과 무한한 사랑을 가진 여러분들의 보육원 교사 수료식을 축하드립니다.
112,0,7,주제별인사,8,수료식,웹디자이너 수료식,"오늘 새롭게 웹디자이너 과정을 모두 마친 원생 여러분들의 뿌듯한 얼굴을 보니 지난 6개월간 고생했던 날들이 다시 생각납니다.웹은 늘 변하고 발전하고 살아있는 생물처럼 숨쉬지만 웹디자인이란 것은 그만큼 따라서 움직여야 하는 운명을 가지고 있습니다.여러분들도 그 운명을 받아들이고 이렇게 이 자리에서 한 결의를 다지고 있는 걸 보니 선배 디자이너로서, 그리고 같은 업종의 종사자로서 격려의 박수를 크게 치고 싶습니다."
113,0,7,주제별인사,8,수료식,코디네이터 과정 수료식,"사람이 필요로 하는 세가지, 의, 식, 주 중에 의가 제일 먼저 앞에 나오는 이유가 옷이란 연약한 사람의 피부를 감싸주기도 하지만 정체성과 존재감을 나타내는 가장 중요한 부분이 아닌가 생각이 듭니다.오늘 수료식을 갖는 졸업생 여러분, 여러분은 옷이라는 필수 요소보다는 인간이라는 주제를 찾아보시길 바랍니다.코디네이터란 옷을 고르는 일이 아닌 옷으로 표현하는 그 주제를 찾는 작가라는 점을 기억해주셨으면 합니다."
114,0,7,주제별인사,8,수료식,문학 아카데미 수료식,"학생 여러분, 그동안 수고 하셨습니다.오늘 수료식이 끝이 아니라는 것을 여러분들이 더 잘 아실겁니다.여러분들은 이제 갓 걸음마를 떼었을 뿐이고 더 나아가 앞으로 뛰어갈 순간을 맞이하게 될 것입니다.더 큰 세상을 향해 매일매일 정진하십시오.매일 한 줄의 글을 쓰고 그 글을 다시 문장으로, 문단으로, 하나의 작품으로 만들어 가보십시오.시간은 짧지만 여러분들의 능력은 무한합니다."
115,0,7,주제별인사,8,수료식,특수학교 수료식,"몸이 불편한 것보다 마음이 불편한 것이 더 큰 장애라는 것을 오늘 우리 특수학교 학생들의 수료식을 맞이하여 새삼 느끼게 됩니다.우리 학생들은 비록 신체적 능력이 조금은 부족할 지라도 언제 어디서든 자립하여 올바른 생각과 행동으로 우리 사회의 멋진 구성원이 될 수 있음을 확인해주었습니다.이제 여러분들은 새로운 환경, 새로운 학업을 맞이하게 될 것입니다.이에 그 앞날에 축복을 드리고 싶은 마음에 다함께 격려의 박수를 보냅시다."
116,0,7,주제별인사,8,수료식,노인대학 수료식,"오늘 뜻깊은 자리에 참석해주신 어르신들과 일가친척 여러분들, 반갑고 고맙습니다.사회에서 노인이란 힘없고 경제적 능력이 없는 부류가 아니라 쌓인 지혜를 후손에 나눠주고 삶의 역사를 새롭게 정리하는 지적 생산층이라는 것을 우리 어르신들이 몸소 보여주신 것에 감사드리며오늘 수료식을 거행하겠습니다."
117,0,7,주제별인사,8,수료식,과학영재 수료식,천재는 태어날 때부터 만들어지기 보다 지속적으로 자신을 갈고 닦는 수련의 과정이라고 할 수 있습니다.영재 여러분! 오늘 수료식을 마치지만 이제부터가 시작입니다.지금까지는 여러분이 공부하는 길을 찾아주었을 뿐 이제 그 길을 걸어가는 것은 여러분들의 몫입니다.그 길을 가는 여러분들의 앞날에 밝은 빛이 쏟아지기를 기원합니다.
118,0,7,주제별인사,8,수료식,평생학습센터 수료식,"학생 여러분!배움에는 끝이 없다고 합니다.지금 수료식을 하면서 우리 학습센터를 나가시더라도 댁에서, 그리고 다음 학원에서 끝없이 배우고 익히고 자신에 대한 믿음을 버리지 마십시오.배우고 익힌다는 것은 살아있다는 뜻이며 그 삶이 충분히 가치 있다는 뜻이기 때문입니다."
119,0,7,주제별인사,8,수료식,신교대 수료식,젊은 시절에 한번쯤은 나라를 생각하고 애국심을 기르는 시간도 한편 필요하다고 봅니다.나이가 들어감에 따라 생활에 치여 살아가면서 나라를 생각한다는 건 힘든 일이기 때문입니다.젊은 장정 여러분!힘든 신교대 훈련을 마치고 이제 건장한 대한민국의 청년으로 다시 태어난 여러분들의 앞날을 축하드립니다.
120,0,7,주제별인사,9,입주환영,인연을 만들어 가는 집,"내 집 한 채 마련하는 것을 평생 과업으로 살아오신 이웃분들에게 환영의 인사를 올립니다.집이란 것이 일반 물건과는 달라서 나와 인연이 닿아야 내 몸 누울 수 있는 곳이 된다고 합니다.우리 아파트는 그런 분들이 모여서 만든, 그야 말로 인연을 만들어 가는 집이 되었으면 합니다.여러분, 입주를 환영합니다."
121,0,7,주제별인사,9,입주환영,도시와 다른 차이가 있는 아파트,"도시의 아파트는 너무 많아서 아침에 차도 많이 밀리고 주차 공간도 부족하지 않으신가요?이제 우리 아파트는 아파트 이상의 주거 문화를 이뤄갑니다.화합, 안정, 절약, 그리고 행복. 이 네 가지는 우리 아파트 입주민들이 만들어갈 가치이자 도시와 다른 차이라 생각합니다.입주를 환영합니다!"
122,0,7,주제별인사,9,입주환영,어릴 적 그리운 집,여러분! 살아오면서 가장 기억에 남는 집이 있습니까?어릴 적 앞마당에 강아지가 뛰어놀고 여름이 되면 정자의 그늘이 시원하게 펼쳐지던 곳... 그 그리운 집을 다시 만나고 싶지 않으신가요?그렇다면 우리 맨션의 앞 마당을 가보십시오. 행복을 만나실 수 있을 것입니다.
123,0,7,주제별인사,9,입주환영,이상이 실현되는 집,많은 사람들이 꿈꾸던 곳. 집이 가장 편하고 행복하다는 생각이 절로 드는 집.바로 우리 빌라가 만들어 가는 이상향입니다.그 이상향이 눈 앞에서 실현되는 것을 살아가면서 확인해보십시오.꿈은 이뤄진다는 것을 보실 수 있을 것입니다.
124,0,7,주제별인사,9,입주환영,웰빙 주택,아이들이 마음껏 뛰어 놀 수 있는 곳을 찾으셨습니까?땅냄새가 나는 어릴 적 향수를 그리워하셨습니까?단지 전원주택이라는 이름으로 해결할 수 없는 웰빙 주택에 오신 것을 환영합니다.
125,0,7,주제별인사,9,입주환영,이웃사촌간의 정,예부터 집은 사람살기 좋은 곳에 지어야 한다고 했습니다.그 말 뜻엔 물 맑고 경치 좋을 곳이라는 뜻도 있겠지만 이웃간의 정이 돈독해야한다는 뜻도 있지 않을까요?우리 마을은 그래서 이웃사촌 안 부럽다고 소문이 난 곳입니다.오늘 이웃사촌이 되신 여러분! 환영합니다.
126,0,7,주제별인사,9,입주환영,집의 의미,여러분! 여러분에게 집이란 무엇인까?생활 공간인가요? 투자의 대상인가요? 아니면 자손에게 물려줄 자산인가요?많은 의미가 있겠지만 가장 중요한 것은 바로 하루를 마감하고 편안하게 잠자리에 들 수 있는 따뜻한 보금자리의 의미가 아닐까 싶습니다.그 보금자리를 찾아온 여러분들을 환영합니다.
127,0,7,주제별인사,9,입주환영,조합원에게 환영의 인사,안녕하십니까?그동안 외지에서 우리 아파트가 지어지기를 기다려온 조합원 여러분들에게 수고했다는 말씀을 드립니다.우리 조합은 그동안 안전하고 튼튼한 아파트를 짓기 위하여 시공사와 여러 가지 문제점을 꼼꼼하게 지적하고 감리하였습니다.이제 입주를 앞두고 여러분에게 환영의 인사를 할 수 있게 된 점을 감사하게 생각합니다.
128,0,7,주제별인사,9,입주환영,넓은 하늘 아래 내 보금자리,이 넓은 하늘 아래 내 보금자리를 마련한다는 것은 참 힘들고 어려운 일인 것 같습니다.그 중에서도 산과 물이 있는 우리 마을에 입주하신 입주민 여러분들은 선택받은 분들이 아닐까 싶네요. 반갑습니다!그리고 환영합니다!
129,0,7,주제별인사,9,입주환영,이웃분들간의 화합을 이끄는 아파트,"사랑과 행복이 있는 우리 아파트에 입주하신 이웃분들, 반갑습니다.다른 아파트보다 1년 더 건설기간을 정해서 꼼꼼하고 세심하다는 평가를 받고 있는 우리 아파트는 그 정성만큼이나 이웃분들간의 화합을 이끌어나갈 거라고 생각합니다."
130,0,7,주제별인사,10,입사인사,인터넷 강국을 이어갈 한 방울의 땀,인터넷 강국인 우리나라에서 인터넷 회사에 다닌다는 것은 크나큰 자부심이 아닐 수 없습니다.그래서 오늘 첫 출근을 하는데 괜히 어깨에 힘이 들어가고 걸음걸이도 당당해지더군요.회사의 품위를 지키고 명예로운 사원이 되도록 노력하겠습니다.인터넷 강국을 이어갈 한 방울의 땀도 아끼지 않고 열심히 일하겠습니다.앞으로 열심히 하는 저의 모습을 지켜봐 주시면 감사하겠습니다!
131,0,7,주제별인사,10,입사인사,옷 만드는 회사에서 일하게 된 꿈,"예전에 우리 ○○회사 옷을 입을 땐 참 잘 만든다 만족했었던 기억이 있습니다.멋진 디자인가 촉감, 그리고 내 체형에 딱 맞는 사이즈는 옷 입는 즐거움을 주었지요.이제 그 옷을 만드는 회사에서 제가 일하게 된 것이 꿈만 같습니다.저도 다른 누군가에게 옷 입는 즐거움을 줄 수 있게 되다니 얼마나 좋은 지 모릅니다.이렇게 즐거운 마음으로 즐겁게 일하겠습니다!"
132,0,7,주제별인사,10,입사인사,새로 태어난 느낌,"오늘 첫 출근을 하기 위해 어제 밤부터 마음이 많이 설레였습니다.나도 이제 어엿한 직장인이 되었구나, 생각하며 행복한 밤을 보냈습니다. 그리고 이렇게 선배님들 앞에 인사를 드리게 되니 마치 새로 태어난 느낌입니다.지금 이 마음을 잊지 않고 순수함을 지키며 땀흘려 일하는 일꾼이 되리라 다짐합니다.모르는 것이 있으면 솔직히 여쭈보고 배우는 자세로 ○○그룹의 당당한 일원이 되겠습니다.많은 지도 편달 부탁드립니다."
133,0,7,주제별인사,10,입사인사,높은 사무실에서 내려다보는 하나의 포부,"이렇게 높은 사무실에서 저 아래 빌딩들을 내려다보니 하나의 포부가 생깁니다.저도 빌딩을 하나 갖고 싶다는 야망입니다. 물론 야망일 뿐이지만 푸른 희망으로 생각하고 한 발자국씩 나아가겠습니다.오늘 처음 인사를 드리는 이 순간을 잊지 않고 열심히 살아서 훗날 오늘을 기억하며 웃을 수 있었으면 좋겠습니다.선배님들, 반갑습니다!"
134,0,7,주제별인사,10,입사인사,평생 직장,요즘은 평생 직장이 없다고 하지요. 한번 회사에 들어오면 10년이고 20년이고 매일 아침 9시까지 출근하던 예전 모습을 찾아보기 힘들다고 합니다.하지만 저는 우리 회사에서 살고 우리 회사에서 죽을 각오를 하고 들어왔습니다.많이 도와주십시오. 열심히 하겠습니다!
135,0,7,주제별인사,10,입사인사,늘 한결 같은 마음,어릴 땐 부모님의 지도를 받고 학교 다닐 땐 선생님의 가르침을 받았지만 이제 회사에서는 상사와 선배님들께 배워야 한다고 생각합니다.졸업을 한 지 얼마 되지 않아서 부족한 점이 많습니다.하지만 누구보다도 부지런하고 꾀부리지 않는 자세로 우리 회사를 위해서 열심히 일할 것을 약속합니다.늘 한결같은 마음으로 회사생활 하겠습니다. 감사합니다.
136,0,7,주제별인사,10,입사인사,대학 합격 이후로 가장 큰 성취감,안녕하세요? ○○○ 이라고 합니다.그토록 원하던 회사에 입사해서 그런지 어제 오늘 마냥 행복합니다.대학 합격 이후로 가장 큰 성취감을 갖게 된 것 같습니다.하지만 회사를 다니면서 매일매일 더 큰 보람과 발전을 이룰 수 있게 항상 노력하는 사원이 되겠습니다. 많이 도와주세요.
137,0,7,주제별인사,10,입사인사,정식 입사 인사,"안녕하세요? 입사 후 정신 없이 지내다 보니 벌써 1주일이 지났네요.그동안은 오리엔테이션 기간을 지내면서 잘 몰랐지만 서서히 선배님들과 임직원 여러분들, 그리고 회사 구조도 잘 알게 되었습니다.정식으로 인사드립니다. 무역부의 귀염둥이 신입사원 ○○○ 입니다."
138,0,7,주제별인사,10,입사인사,서로 의지할 수 있는 공간,회사는 이익을 내야하기 때문에 어쩔 수 없이 경쟁이 있어야 하고 친구처럼 편안할 수는 없는 거라고 하죠.하지만 마음만은 포근하고 서로 의지할 수 있는 공간으로 제가 이제부터 즐겁게 일해보겠습니다.선배님들과 함께 회사에 나오는 것이 재밌고 보람 있는 일로 만들어 가고 싶습니다.
139,0,7,주제별인사,10,입사인사,가족적인 분위기,이전 회사에서는 직원들이 적어서 그런지 소위 말하는 가족적인 분위기였습니다.회사는 가족이 아니지만 하루 대부분의 시간을 보내는 것만큼 가족보다 더한 친밀감이 있어야 한다고 봅니다.선배님들의 따뜻한 표정을 보니 마음이 포근해지는 것도 그런 친밀감이 느껴지기 때문인 것 같습니다. 앞으로 잘 부탁드립니다.
140,0,7,주제별인사,10,입사인사,땀흘려 일하는 성실한 모습,제가 이렇게 선배님들 앞에 인사를 드리게 된 게 참 꿈 같습니다.불과 저번 주까지만 해도 도서관에서 200원짜리 자판기 커피를 마시며 근처에 점심 식사를 하러 가는 직장인들을 참 부러워했는데 말이죠.이 감격스러운 순간을 위해서 열심히 공부했던 시간이 보람을 찾을 수 있게 하루하루 땀흘려 일하는 성실한 모습을 보여드리겠습니다.
141,0,7,주제별인사,10,입사인사,학교에서 가르쳐주지 않은 것들,처음 인사드립니다. 신입사원 ○○○입니다.아직 모르는 것이 많고 배워야 할 것도 많습니다. 학교에서 가르쳐주지 않은 것들이 너무나 많다는 것을 알고 도움 많이 받겠습니다.실수가 있더라도 너그러이 이해해주시고 넓은 마음으로 포용해주시면 좋겠습니다.그만큼 조금도 꾀부리지 않고 열심히 일하겠습니다.
142,0,7,주제별인사,10,입사인사,취업을 한 감사의 마음,안녕하십니까?기획부에 새로 들어온 ○○○ 이라고 합니다.요즘 취업이 되지 않는다고 청년 실업자들이 몇 십만 명을 헤아린다고 하는데 제가 우리 회사에 입사하게 되어 하늘에 감사할 따름입니다.이 감사의 마음을 잊지 않고 선배님들이 가르쳐주시는 바대로 열심히 배울 것을 약속드립니다.
143,0,7,주제별인사,10,입사인사,매일매일 배우는 자세,안녕하세요?하고 싶은 일을 하고 가고 싶은 곳을 가는 게 얼마나 행복한 일인지 우리는 잘 알고 있습니다.그런 면에서 저는 참 행복한 사람인 것 같습니다. 다니고 싶은 회사에 입사해서 하고 싶었던 일을 하게 되었으니까요.이 행복을 지켜나가기 위해 열심히 일하고 매일매일 배우는 자세로 임하겠습니다.
144,0,7,주제별인사,10,입사인사,신입사원 인사,선배님들!안녕하십니까? 끈기와 성실로 똘똘 뭉친 신입사원 ○○○입니다.일을 잘하는 것도 중요하지만 그 이전에 인사를 잘해야 인정받고 잘 어울릴 수 있다고 들었습니다.앞으로 선배님들께 인사 잘하고 일도 잘한다는 소리를 듣고 싶습니다.잘 부탁드립니다.
145,0,7,주제별인사,11,일일찻집,학생들 일일찻집,"반갑습니다! 학생회장 이민영입니다.학생이 공부는 안하고 일일찻집같은 걸 한다고 꾸지람도 많이 들었지만 일일찻집에 담긴 봉사심, 결속력, 그리고 불우이웃을 돕는 사회성 등도 공부라고 봅니다.비록 학생들이 많이 오셨지만 선배님들과 언니 오빠들도 많이 오셨으니 다행입니다.귀엽게 봐주시고 좋은 일 한다 생각하시면서 편안하게 드시기 바랍니다."
146,0,7,주제별인사,11,일일찻집,회사 직원들의 일일찻집,"우리 직원들이 이렇게 의기 투합하여 일일찻집을 진행하는 것을 보니 우리 회사의 장래가 참 밝구나, 생각이 드네요.업무에 피곤할텐데 자선 일일찻집을 통해 불우이웃을 돕고 제휴회사들과의 돈독한 신의를 쌓는 길을 준비한 여러분들에게 사장으로서 감사의 인사를 드립니다."
147,0,7,주제별인사,11,일일찻집,마을 문고 일일찻집,"우리 마을 문고가 보유량이 벌써 3만권 넘었습니다.그 동안 자유롭게 기증해주신 분들과 한 권이라도 깨끗하게 손질하여 주신 모든 분들께 감사드리며 마을 문고 3주년 기념 일일찻집을 개최합니다.책 한권과 전통차 한 잔, 그리고 직접 만든 다과를 드시면서 책이 주는 감동을 함께 해보시기 바랍니다."
148,0,7,주제별인사,11,일일찻집,봉사대원들 일일찻집,"오늘 봉사대 일일찻집은 단지 수익을 내기 위한 것보다는 봉사대원들의 노고를 치하하고 앞으로 더 열심히 봉사하고 보람을 찾자는 의미로서 봉사대원 전체가 하나로 주인이자 손님으로 만나는 자리입니다.세대를 너머서, 지역을 너머서 항상 수고하시는 우리 봉사대원들에게 오늘 일일찻집을 통해 그 결의를 다시한번 다졌으면 합니다."
149,0,7,주제별인사,11,일일찻집,장학회 일일찻집,젊은 인재의 숨은 실력을 발굴하고 힘찬 미래를 위해 지원하는 우리 장학회의 일일찻집에 오셔서 감사드립니다.오늘 일일찻집에 술은 없지만 술보다 더 진한 사랑이 있고 안주보다 더 풍부한 젊은이들의 푸른 청춘이 있습니다.차 한 잔씩 하시면서 그 멋진 젊음을 도와주시기 바랍니다.
150,0,7,주제별인사,11,일일찻집,동문회 일일찻집,매해 열리는 동문회지만 이렇게 일일찻집을 통해 동문들이 편하게 모이고 이야기하면서 시간대도 자유롭게 하니 참 좋습니다.수익금은 동문회 명의로 불우이웃을 돕는다고 하니 일석이조가 아닌가 싶습니다.동문회장님께 감사드리며 오늘 오신 동문들의 건강을 먼저 빕니다.
151,0,7,주제별인사,11,일일찻집,사랑의 슬픈 향기,"여러분, 베르테르의 슬픔을 아시나요?사랑하는 사람을 떠나보낼 수 밖에 없었던 젊은이의 고뇌와 슬픔... 오늘 일일찻집에서 저물어가는 가을과 함께 사랑의 슬픈 향기를 느껴보시기 바랍니다."
152,0,7,주제별인사,11,일일찻집,부녀회 일일찻집,부녀회에서 매년 여는 일일찻집이지만 올해는 유난히 많은 주부님들이 찾아주셔서 정말 감격스럽네요.일일찻집 수익금 전액은 우리 아이들이 즐겁게 읽을 수 있는 아동도서를 구매하려고 하니 많이 많이 팔아주세요~
153,0,7,주제별인사,11,일일찻집,소나기처럼 시원한 미숫가루,한바탕 소나기라도 쏟아질 것 같은 분위기입니다.이 더운 날 시원하게 쏟아지길 바라며 오늘 오신 손님 여러분들에게 소나기처럼 온몸을 시원하게 만들어줄 얼음 동동 미숫가루를 선보입니다.시원하게 드시고 오늘 일일찻집 많이 응원해주세요~
154,0,7,주제별인사,11,일일찻집,성공적인 일일찻집,오후까지 차를 마시던 분위기가 저녁이 다가오니 슬슬 술을 찾으시는 분들이 많네요.오늘 일일찻집은 대성공인 듯 합니다.지금부턴 전통주와 함께 파전이 준비됩니다.일일찻집의 성공적인 마무리를 축복하는 의미에서 다함께 건배할까요?
155,0,7,주제별인사,11,일일찻집,봄 냄새가 물씬 풍기는 일일찻집,창 밖에 보이는 노란 개나리들이 3월의 마지막 날을 축복하네요.올 봄은 어느 때보다 개나리들이 풍성하게 펴서 오늘 일일찻집도 봄 냄새가 물씬 풍기네요.아름다운 봄에 만나는 자선 일일찻집에 오신 여러분들에게 그런 의미에서 향긋한 자스민차를 서비스로 먼저 제공하겠습니다.행복한 시간 만나보세요.
156,0,7,주제별인사,11,일일찻집,눈을 몰고 올 듯 낮게 떠 있는 회색 구름,"여러분, 지금 창 밖에 첫눈이 내린다면 어떠실 것 같아요?아마도 오늘 일일찻집이 대박이지 않을까 싶습니다.회색 구름은 눈을 몰고 올 듯 낮게 떠 있네요.창 밖으로 하나둘 흰눈이 나린다면 오늘 일일찻집에 오신 여러분들에게 좋은 선물이 될 듯 합니다."
157,0,7,주제별인사,11,일일찻집,커피와 문학의 만남,"안녕하세요? 오늘 일일찻집을 준비한 국문과 학생회장 김시향입니다.오늘은 특히 다른 과에서도 많이 오셔서 고맙습니다.시와 사진, 그리고 아름다운 유화가 있는 시화전에 오신 것으로 생각하시고 외국에서 직접 공수해온 에스프레소 향과 문학의 만남을 즐겨보시기 바랍니다."
158,0,7,주제별인사,11,일일찻집,고향의 향,"요즘 일일찻집은 그저 형식적인 면만 있는 거 같습니다.쉽게 꾸미고 그저 돈만 받으려는 찻집... 하지만 우리 일일찻집은 집에서 직접 말린 국화와 율무, 그리고 올해 말린 무화과로 여러분들에게 고향의 향을 선보입니다.향긋한 차와 함께 이 가을의 주인이 되어 보세요."
159,0,7,주제별인사,11,일일찻집,연인과 함께 나누는 차 한 잔,"이렇게 바람이 불고 스산한 날, 연인과 함께 나누는 차 한 잔... 마음이 편안해지지 않으세요?오늘 일일찻집 테마는 바로 가을의 사랑입니다.초대받은 연인들의 모습으로 아름다운 시간 가져보시기 바랍니다."
160,0,7,주제별인사,12,이직인사,안정을 추구해야할 늦은 나이,"안정을 추구해야할 늦은 나이에 이직을 한다고 하니 집사람부터 시작해서 친구들, 동료들, 부모님까지 모두 반대를 하더군요.하지만 그 안정이란 것이 저에게 그토록 중요한 것이라면 회사에서는 불필요한 것일 수도 있습니다.왜냐하면 안정된 업무는 매너리즘에 빠지기 쉽고 회사는 그만큼 도태될 수 있기 때문이죠.이제 저의 결정이 부질없는 것이 아니길 바라며 걱정해주신 분들에게 이렇게 말씀드리고 싶습니다.항상 같은 마음으로 실패해도 멋진 시도를 해봤다고, 웃으며 말하고 싶습니다."
161,0,7,주제별인사,12,이직인사,개척하는 인생,인생은 개척하는 거라고 했는데 저는 이번 이직으로 처음 제 삶을 개척해 봅니다.돌아보면 저는 그동안 너무 쉬운 길을 걸어왔습니다. 한번도 실패가 없었고 늘 선두에 서 있었기에 겸손과 배려가 부족했습니다.나이가 들면서 깨닫게 된 이 사실이 저를 부끄럽게 했고 저는 이번 결정을 출근길에 했습니다.그리고 이렇게 인사를 드립니다.그 동안 부끄러웠던 것을 치료하고 겸허한 마음으로 회사를 다닐 것입니다.나중에 술 한잔 사겠습니다. 잘 하라고 격려해주시면 감사하겠습니다.
