,label,class0 id,class0 name,class1 id,class1 name,keyword,sentence
225,0,4,시간인사,4,오후,빨간 노을이 지는 가을 오후,안녕하세요?오늘도 서쪽하늘에 빨강게 노을이 지길 기다리며 추억에 잠길 준비를 하고있는 가을 오후 입니다.
226,0,4,시간인사,4,오후,변덕 날씨,아침부터 화창하던 날씨가 오후 들어 빗줄기를 뿌려대는 변덕을 부리고 있습니다.오늘 토요일이라 나들이 나갔던 사람들이 낭패겠네요.
227,0,4,시간인사,4,오후,기승을 부리는 늦더위,늦더위가 기승을 부려 9월이 되어서도 열대야를 겪는 요즘입니다.지난 밤잠을 설쳤더니 오후 들어 졸음이 무지 밀려오네요.
228,0,4,시간인사,4,오후,휴일 오후,늦게까지 늦잠을 자고 일어난 휴일 오후에 할 일 없이 빈둥빈둥 거리는 것도오랜만에 해보는 행복인 듯 느껴집니다.
229,0,4,시간인사,4,오후,9월 첫날,어제까지 덥게 느껴지던 바람이 9월 첫날인 오늘은 시원하게 느껴지네요.조금 기온이 낮아진 것이 바람에서 느껴지는 오후입니다.
230,0,4,시간인사,4,오후,더운 5월,"아침엔 아직 서늘한 기온이지만 오후가 되면 초여름 냄새가 나는,약간은 더운 5월 중순입니다."
231,0,4,시간인사,4,오후,빨래,햇볕이 좋아 아침에 널어놓은 빨래가 오후가 되면 금방 바짝바짝 마르는 4월 봄날입니다.
232,0,4,시간인사,4,오후,한강 공원,날이 풀려서 오랜만에 나가본 한강 공원엔 자전거와 인라인스케이트를타는 사람들이 무척 많아졌더군요.겨울은 이미 저만치 물러갔나 봅니다.안녕하세요? ○○○님. 3월의 따뜻한 오후입니다.
233,0,4,시간인사,4,오후,분주한 월요일,분주한 월요일 오전을 보내고 난 오후에는 주말에 쌓인 피로가겹쳐 한 주가 더욱 길게 느껴지네요.그래도 다시 주말까지 힘차게 달릴 준비를 해봅니다.안녕하세요? ○○○님.
234,0,4,시간인사,4,오후,페파민트,"머리를 맑게 해주는 허브 중에 하나인 페파민트는 봄날 오후의졸음을 가시게 하는 효능을 가지고 있다고 합니다.○○○님, 피곤한 오후를 시원한 페파민트 향으로 날려보세요."
235,0,4,시간인사,4,오후,동네 공원,동네 공원에 나가 나무 그늘 아래서 책을 읽는 오후에는 가을의햇살이 참으로 고맙다는 생각을 하게 되네요.안녕하세요?
236,0,4,시간인사,4,오후,회색하늘,아침부터 흐렸던 날씨가 오후 들어서도 계속해서 회색하늘이더니결국 지금은 흰눈이 펑펑 내리고 있네요.추운 겨울이 시작될 모양입니다.
237,0,4,시간인사,4,오후,경쾌한 음악,"○○○님,요즘처럼 점심 식사를 하고 나면 졸음이 쏟아지는 봄날 오후엔 경쾌한음악을 들으며 녹차 한 잔 해보세요.오후를 가볍게 보내실 수 있을거에요."
238,0,4,시간인사,4,오후,추수,추수가 끝난 들녘에서 불을 피우는 농부님들의 여유로운 모습이평화로워 보이는 11월 오후입니다.
239,0,4,시간인사,4,오후,동네 강아지들,더웠던 낮동안 어딘가 숨어 있다가 해가 지기 시작하면서하나둘 보이는 동네 강아지들이 무척 귀엽게 느껴집니다.
240,0,4,시간인사,4,오후,화창한 봄날,자동차를 타고 어디 한적한 시골길을 천천히 달리며 봄바람을 즐기고싶은 화창한 봄날 오후네요.
241,0,4,시간인사,4,오후,창경궁,"○○○님,어제 일요일 오후엔 오랜만에 가족들과 창경궁에 가서 화사한봄날의 햇살을 즐기며 행복한 시간을 가졌더니오늘 월요일이 다른 때와는 달리 무척 가볍네요."
242,0,4,시간인사,4,오후,장마,장마가 잠시 그친 틈을 타고 오랜만에 햇볕을 보였던 하늘이 오후가 되니다시 흐려져 장마비가 쏟아질 태세입니다.긴 장마 동안 잘 지내고 계신지요.
243,0,4,시간인사,4,오후,폭염,폭염이 지속되고 있어 거리에 다니는 사람들이 거의 없는 8월의 뜨거운 오후입니다.
244,0,4,시간인사,4,오후,노란 개나리,오후 들어 내리는 비가 봄을 재촉하듯 노란 개나리들을 촉촉이적셔주고 있습니다.비가 그치면 파란 잎들이 더 많이 나겠지요?
245,0,4,시간인사,4,오후,봄햇살,하얀 민들레 홀씨들이 날아다니고 봄햇살이 따뜻하게 비추는 나른한 봄날 오후입니다.
246,0,4,시간인사,4,오후,마른 낙엽,작은 바람에도 마른 낙엽들이 힘없이 떨어지는 늦가을 오후가더없이 쓸쓸해 보이는 11월입니다.
247,0,4,시간인사,4,오후,아파트 단지,비가 그치면서 멀리 보이는 아파트 단지부터 만들어진 무지개가신기하게 하늘에 걸린 오후입니다.
248,0,4,시간인사,4,오후,창 밖 풍경,오후가 지나가는 풍경을 창 밖으로 내다보고 있으면하루가 너무나도 빨리 가는 느낌을 받곤 합니다.안녕하세요? ○○○ 입니다.
249,0,4,시간인사,4,오후,늦가을,"○○○ 님, 안녕하세요?짧아진 오후 덕분에 일찍 노을이 지는 하늘을 볼 수 있는 늦가을을 보내고 있습니다."
